date,type,header,text,video,photo,Credit_photo/video,coordinates,coordinates_text,map_poly,map_lines,map_points,focus_point,zoom,idToShow
2022-03-11,war,Атака на перехресті Купріна і Митрополитської,"12-го березня росіяни пішли у масовану атаку на цій ділянці – із танками, БТР-ми та піхотою. Українські бійці приїхали на перехрестя вулиці Купріна та Митрополитської. Там вже другий день поспіль їздили російські Т-72, які рандомно обстрілювали багатоповерхівки.

- Ми об’єднались з тими, хто вже стояв на позиціях (а там були молоді азовці, нацгвадійці та хтось з ДПСУ), - розповідає Пустовойт, - і почався бій. По російському Т-72, який під’їхав на перехрестя, почали палити з кількох точок, у тому числі – з багатоповерхівки. Танк вибухнув, башта відлетіла. В цей час молодий прикордонник знищив російський БТР-82А, але отримав смертельне поранення у груди. Його тіло потім евакуювали нацгвардійці. 
",,,,"47.10795, 37.50991",Перехрестя вулиць Купріна і Митрополитської,,,11_03_points.geojson,"47.11, 37.57",12,
2022-03-11,war,,"Згодом з’явився ще один БТР із десантом, який рухався у бік обласної лікарні. Володимир Малецький, боєць нашого підрозділу, вистрілив з РПГ у задню частину цього БТРа, російський десант розбігся по приватному сектору, і вже там наші хлопці їх добивали. Всі були на шаленому куражі, настрій був просто прекрасний».",,,,,,11_03_poly.geojson,,,,,
2022-03-12,civil,Авіаудари по центру міста ,12 березня авіаударами по центру міста знищено Будинок зв’язку – маріупольський головпоштамт. Пошкоджено велику кількість будинків навколо нього.,,,,"47.09766, 37.5386", Будинок зв'язку,,,,"47.11, 37.57",12,
2022-03-13,war,Ворожа техніка в тилу,"В глибокий тил українців зайшла колона російських БТР, “Тигрів” та Тайфунів 22-ї бригади спеціального призначення ГРУ (60-80 бійців). Поки тривають бої на околицях, російські спецназівці опиняються в ста метрах від комбінату «Азовсталь», фактично на березі ріки Кальміус, яка розподіляє місто на Правий та Лівий береги. Вони займають будинок на провулку Граверному, після чого їх накриває гаубичний вогонь артилерістів «АЗОВ».",,,,"47.114065, 37.615876","Провулок Граверний, куди прорвалася ворожа колона",,,,"47.11, 37.57",12,
2022-03-14,war,,"

На сході Маріуполя «міліція ДНР» крізь приватний сектор пробивається до багатоповерхівок лівобережжя в районі Собору архистратига Михаїла.
",,,,"47.098570, 37.659856

","Приватний сектор, де ворожий підрозділ пробивався до Лівобережного району",districts.geojson,,,"47.11, 37.57",12,
2022-03-14,war,"Обстріл багатоповерхівок в районі ""Епіцентра""","На заході в районі ""Епіцентру"", по вулиці Флотській та по вулиці Купріна просунутись окупантам не вдається, тому вони просто знищують тамтешні багатоповерхівки.",Флотська Сільпо Епіцентр.mp4,,,,,,,,,,
2022-03-15,civil,Перша евакуаційна колона,"У цей день з Маріуполя вдалось виїхати першій колоні автомобілів із цивільними - за приблизними підрахунками з пекла боїв врятувалось 20 000 осіб. На вулицях у центрі міста лежали загиблі, тіла не було кому забирати. 
Містяни поспішно вантажили речі у свої авто.",,,,,,,,,"47.11, 37.57",12,
2022-03-15,war,Штурм порту,"Почалися обстріли і штурм, ракетою вражено радіолокаційну станцію судна «Лубни», дрон б’є по броньованому катеру «Кременчук».  Особовий склад 9 ДнНК виїхав з порту до бази НГУ на вулиці Нахімова, де їх «приписали» до 12 БрОП (12 бригада оперативного призначення Нацгвардії України). Екіпаж «Донбасу» розкидали по позиціях в місті, а екіпажі катерів (10 осіб) повернулися в порт.

",,,,"47.055475, 37.505733",Маріупольський порт,,,port_points.geojson,"47.11, 37.57",12,
2022-03-15,war,"Керівник оборони порту ""загубився""","Як розповідав один з членів екіпажу пошуково-рятувального судна «Донбас», 24 лютого з 50 осіб екіпажу «Донбасу» залишилось приблизно 40. Інші десять «загубились» разом із капітаном судна Олександром Григоревським, який залишив місто. «Загубився» і Олексій Корецький, який відповідав за оборону порту. 

Окупанти, вочевидь, намагались зберегти порт цілим, але два тижні настільки потужної оборони міста дали зрозуміти, що воювати доведеться за кожен об’єкт. ",,ships.jpg,,,,port_poly.geojson,,,,,
2022-03-16,war,Авіаудар по маріупольському драмтеатру,"16 березня приблизно о 10 годині ранку російська авіація нанесла бомбовий удар по драмтеатру. Саме тут, в центрі міста, щодня збирались сотні цивільних, які могли обігрітись, отримати від волонтерів їжу і теплі речі, а також дізнатись про можливість евакуації. Один з працівників сцени зробив на площах з обох боків будівлі величезні написи «ДІТИ». За результатами розслідування, яке було проведено агенцією Associated Press, кількість загиблих орієнтовно складає біля 600 осіб. 
О 15.05 один з провідних телеграм-каналів окупантів повідомив, що полонений ""азовець"" начебто повідомив, ніби в драмтеатрі був знищений штаб «АЗОВУ», розташований там під прикриттям мирних мешканців. ",,,,,,,,,"47.11, 37.57",12,
2022-03-16,civil,"""Величезна хмара"" на місці драмтеатру","Свідком цих подій стала мешканка Маріуполя Наталя Козуб, яка на той час жила біля драмтеатру та намагалася передати звістку про себе синові з «АЗОВУ»:
- Ми вийшли з підвалу, у якому переховувались, і побачили на місці театру величезну білу хмару, з якої виходили та виповзали силуети абсолютно білих людей. Першою я побачила дівчину у кухарському фартусі. Вона розповіла, що працювала на кухні і в них було завдання приготувати 800 порцій. ",,,Маріупольський драмтеатр після російського авіаудару. Фото: 0629 та Reuters,"47.096178, 37.547929",,,,,"47.11, 37.57",12,
,civil,"""Сука, віддай пігулку. Я в тебе її з горла видеру""","Потім бачила ще одну дівчину з неприродньо вивернутою ногою. Вона вила від болю і просила про допомогу. Я побігла в стоматологічну клініку навпроти театру і знайшла там одну-єдину пігулку знеболюючого. Дівчина проковтнула пігулку, я збиралась вийти, але почула її розповідь: «Азовці поставили на крыше театра миномёт и начали стрелять, тут же прилетел российский самолёт и сбросил бомбу». Це була неправда, і я готова була її просто вбити. Намагаючись дотягнутись до неї, кричала: «Сука, віддай пігулку. Я в тебе її з горла видеру». 
Того дня  мені пощастило виїхати до Запоріжжя, де на мене чекав чоловік.",,1603_dram_2.jpg,,,,,,,,,