date,type,header,text,video,photo,Credit_photo/video,coordinates,coordinates_text,map_poly,map_lines,map_points,focus_point,zoom,idToShow
2022-02-23,civil,Теплий вечір перед війною,"23 лютого в Маріуполі було тепло — приблизно +15, що дивно навіть для південного міста. І незвичайно тихо. Так тихо, що аж моторошно. Можливо, відчуття тривоги, яке того вечора ширилося містом, зʼявилося не випадково. Щось дивне напередодні відбувалося в окупованому Донецьку. Тривоги, незрозумілі обстріли, примусова евакуація людей. Росіяни не займалися евакуацією 8 років війни, аж раптом… Усе свідчило, що наближається щось страшне. Але того теплого й тихого вечора про таке не хотілося думати.
На пірсі було багато людей. Вони гуляли, вдихали солоне морське повітря та закарбовували цю красу й тишу у своєму серці. Так, про всяк випадок, а раптом це востаннє…",,2402_mariupol2.jpg,,,,,,,"47.11, 37.57",12,
2022-02-23,war,Укріплення позицій,"За кілька днів до 24 лютого керівництво військових частин і правоохоронців міста не мало сумнівів щодо повномасштабного вторгнення. В ""Азові"" (тоді – Окремий загін спецпризначення (ОСЗП), тепер – штурмова бригада у складі Нацгвардії – ред.) розробили протоколи дій: особовий склад – у вищій готовності, важка техніка виїхала в район Мангуша під виглядом навчань. Патрульна поліція звела укріплення навколо своєї бази, організувала навчання з розгортання особового складу та швидкісного супроводження автоколон.",,,,,,,,,"47.11, 37.57",12,
2022-02-23,war,Перші обстріли,"На лінії зіткнення на схід від міста загострення почалося задовго до 24 лютого – 36-та ОБрМП, яка займала позиції на лінії від Піщовика до узбережжя Азовського моря, зазнавала ударів, але тримала лінію оборони.",,,,,,walls_poly.geojson,walls_line.geojson,,"47.161494856269094, 37.53698025429447",11,"1,2,3,4,5,6,7,8,9"
2022-02-24,civil,Канонада о 5-тій ранку,"О 05:00 Маріуполь здригнувся від канонади. Небо над Лівобережжям було червоне. Завили сирени, попереджаючи про повітряну тривогу, – і це виття чомусь переривалось якоюсь дивною попсовою музикою. Просто сюр, який лякав.
Як і у 2014-му, Лівобережжя й мікрорайон Східний першими потрапили під обстріли ворожої артилерії. А селища на околицях Маріуполя – Талаківка, Сартана, Старий Крим, Гнутове – прокинулися від обстрілів ще раніше, близько 04:00.",2402_east_attack.mp4,,,,,,,,"47.11, 37.57",12,
2022-02-24,war,Зіткнення біля Піщовика,"Путін завершив свою нічну промову (з 23 на 24 лютого), й за мить у Маріуполі почалися вибухи. Їх чули за 15 км на захід від міста. Першими удар прийняли морпіхи 36-ї ОБрМП на сході Маріуполя.
Ось як розповідає про той день Кирило ""Лірік"", командир взводу 36-ї ОБрМП, який був на позиції біля селища Піщовик:
– О п’ятій ранку прилетіли близько 20 снарядів з “Градів”. Перебило світло, але шкоди від них було менше, ніж від “120-х” мін напередодні. О 6:30 запрацювати міномети. Зв’язок глушили, дізнатися загальну обстановку було майже нереально. ",,,,"47.270555, 37.771671",,,,,"47.270555, 37.771671",12,
2022-02-25,war,Морпіхи відступають,"Трохи згодом почувся гуркіт важкої техніки. Нам вдалося підбити один російський танк, але цього було надто мало.
Знову запрацювали міномети, на горизонті з’явилися перші БМП-2 противника з піхотою. Одну з них ми підбили гранатометом.
Вдалося зв’язатися з командуванням – отримали команду відходити, сили мали нерівні.
Устигли взяти лише найважливіше: документи, тепловізор і “нічник”, радіостанції та прилади спостереження. Боєкомплект забрати не могли – його підпалили, разом з ним згоріла й решта речей. 
Відійшли до тилового пункту управління. Дорогою нас забрав БТР. Далі потрібно було дійти до наступної лінії оборони, поповнити боєкомплект і зайняти інші позиції.",,,,,,,,,,,
2022-02-24,civil,Маріупольці йдуть на роботу,"Важкий ранок. Кожен мав обрати для себе стратегію поведінки. І слід сказати, що більшість людей у Маріуполі обрала тактику, якій слідувала останні 8 років гібридної війни: хоч би що відбувалося – треба йти на роботу. Так було й цього разу. Заводські автобуси везли людей на комбінати, немов нічого не сталося. Бо заводи для маріупольців упродовж десятків років були острівцем стабільності та зрозумілості. Хоч би що відбувалося – сталь вариться. Навіть під час Другої світової війни так було. Але не зараз.
Уже першого дня війни керівництво комбінату імені Ілліча та ""Азовсталі"" ухвалило рішення призупинити виробництво. Спочатку це була ""гаряча"" зупинка, що давала змогу швидко перезапустити виробництво. Але невдовзі стало зрозуміло, що треба зупиняти металургійні печі. Почалася війна.",,,,,,,,,"47.11, 37.57",12,
2022-02-24,war,Аеропорт,"Водночас теж о 6:30 бійці ОЗСП “АЗОВ” на базах у Юр’ївці та Урзуфі завантажили зброю й колонами рушили до Маріуполя. 
Частина танків “АЗОВа” заїхала на територію Міжнародного аеропорту Маріуполя, де після закриття у 2014 році було створено базу оборонців міста. 


",,,,"47.077161, 37.462718","Маріупольський аеропорт, база оборонців міста",,sectors_line.geojson,,"47.11, 37.57",11,"1,2,3,4"
2022-02-24,war,Чотири сектори оборони,"– 21–22 лютого місто поділили на чотири сектори, – розповідає Давід Касаткін, лейтенант 2-го батальону ОЗСП “АЗОВ”. – За два з них відповідали наші 1-й і 2-й батальони. Ми з командиром мого батальону Микитою Надточієм їздили по підрозділах, підпорядкованих нам у рамках сектору оборони, щоб зібрати інформацію про кількість людей і зброї.
У прикордонній службі нам не відповіли – сказали, немає наказу керівництва.
Зранку 23 лютого мене відправили в аеропорт до штабу протидесантної оборони. Там був його керівник – полковник, а також оперативники від різних військових підрозділів. Я на цій зустрічі представляв ""АЗОВ"". У мене в підпорядкуванні була рота та група швидкого реагування з 40 бійців, призначена для висування в місця десантування або проривів.",,,,,,sectors_poly.geojson,,,,,
2022-02-24,war,Ворожі судна в морі. Шок і паніка,"– 24 лютого о 04:00 ми побачили на дисплеї, що з боку Єйська Азовським морем до Маріуполя рушили два величезні судна, –  продовжує Давід Касаткін з “АЗОВа”. – Полковник натис на кнопку тривоги та скомандував мінувати акваторію й висуватися в район зосередження. Усі оперативники віддали відповідні накази своїм підрозділам.
“Азовці” мали чекати на накази в домовленому місці. В інших підрозділах почалася паніка. Одна жінка просто питала: ""Що мені робити? Що мені робити?"". 
Люди, які досі не брали участі в бойових діях, були шокованими. Судна з Єйська маневрували в морі. ",,,,"46.90484, 37.87134","В морі помічені ворожі судна, що рухалися з  напрямку Єйська",,,,"46.90484, 37.87134",14,
2022-02-24,war,Обстріл аеропорту,"— Близько 09:00 по маріупольському аеропорту почала бити авіація й корабельна артилерія. Полковник, який керував штабом оборони в аеропорту, кудись зник, як і всі “оперативники”, після першого ж обстрілу.

“Редіс” (Денис Прокопенко), якому я доповів, наказав повертати всіх на місця. Я виявив їх надворі в бліндажі, — пригадує Давід Касаткін з ""Азова"". —  Заспокоїв, розповів, що авіація вдарила далеко, а корабельна артилерія не влучила. Повернулися двоє людей. Один з них – хлопець, який відповідав за контроль переміщення суден у морі. Я взяв на себе координацію й командування.
",,,,"47.077161, 37.462718","Маріупольський аеропорт, база оборонців міста",,,,"47.11, 37.57",12,
2022-02-24,war,Відповідальні за оборону зникали один за одним,"Ближче до обіду повернувся полковник. Проте зникла жінка, відповідальна за моніторинг авіапростору. Вона виїхала до Запоріжжя. 
Замість неї нікого не було. Стало зрозуміло, що ми не знатимемо, де висадиться ворожий десант. 
Тому вирішили перекрити дороги на Маріуполь, а також ту, що вела в місто з боку узбережжя до аеропорту. Сподівалися, що в разі висадки зможемо зустріти десант хоча б на його шляху. Нашу роту з 40 бійців розділили навпіл. 
",,,,"47.077161, 37.462719","Маріупольський аеропорт, база оборонців міста","намалювати дорогу, що веде з аеропорту до маріуполя?",,,,,
2022-02-24,war,,"Під вечір полковник переконував відступати до Маріуполя. Але наказу залишати аеропорт не було.
Полковник пішов на перекур і поїхав. Я доповів “Редісу”. Той спочатку не повірив, але хвилин за 20 передзвонив зі словами “Він не повернеться”. 
В аеропорту залишилася документація, ноутбуки й радіостанції. Ми все зібрали й уже за наказом виїхали до Маріуполя.",,,,,,,,,,,
2022-02-24,war,Українці формують окремий батальйон тероборони,"Під керівництвом командира 109-ї ОБрТрО майора Дмитра Стебліна було сформовано окремий батальйон тероборони – 107-й ОБТрО. 24 лютого бійців зібрали в покинутому навчальному закладі на Лівому березі.

– Наступного дня ввечері прийшла команда виїздити до пункту дислокації Нацгвардії, де ми отримали бронежилети та кевларові шоломи, – розповідає Олександр Кінякін, один з новобранців. ",,,,"47.105497, 37.560632",Розташування бази ТРО в Маріуполі у перші дні війни,,,,"47.105497, 37.560632",13,
2022-02-24,war,Ракетний удар по позиціях української ППО,"Неподалік аеропорту, на захід від Маріуполя, росіяни ракетним ударом знищили РЛС 5Н84А ""Оборона"", яка належала 164-й радіотехнічній бригаді ППО (в/ч 2109). Після удару підрозділ евакуювався (найімовірніше — в напрямку Запоріжжя). Також два удари було завдано по позиціях дивізіону 301-го зенітно-ракетного полку. Під час другого удару, о 09:00, загинув сержант Олег Ясковець. 
За словами підполковника 301-ї ЗРП Олександра Даниленка, перший удар було завдано о 05:00, після чого дивізіон почали готувати до евакуації.  Пізніше С-300, що залишала Маріуполь, було помічено на дорозі біля західної межі міста.",,2402rls_ukr2.jpg,,,"Розташування української РЛС, розбитої ворогом,

        
На західній околиці міста помічено систему ППО С300, яка залишала місто",,,,"47.11, 37.57",12,
2022-02-24,war,Ворожий десант,Того самого дня за 70 км на захід від Маріуполя висадився російський морський десант.,,,,"46.83903, 36.94322",Приблизне місце висадки російського десанту,,,,"46.83903, 36.94322",11,
2022-02-24,war,,Близько 30 БТР з трьох десантних кораблів (810 ОБрМП). Однак бойових зіткнень в ними не було.,02_desant.mp4,,,,,,,,"47.11, 37.57",12,
2022-02-24,war,Морський порт. Підготовка до оборони,"У морському порту базувалися кораблі 9-го ДнНК (9-й дивізіон надводних кораблів) та 23-го ЗМО (Маріупольський загін морської оборони): кілька броньованих катерів і прикордонний сторожовий корабель “Донбас” BG-32. 
— Ми патрулювали в морі ще за тиждень до 24 лютого й там зустріли перші обстріли, – згадує Віктор Шапошников, матрос малого броньованого артилерійського катера ""Кременчук"". — Повернулися до порту, замінували фарватер і Нові ворота (один з двох входів до акваторії порту) 160-кілограмовими якірними мінами, нам привезли 32 штуки зі складу в Очакові.

",,,Корабель 9 ДнНК (9 дивізіону надводних кораблів),"47.055475, 37.505733",Морський порт Маріуполя,,,port_points.geojson,"47.11, 37.57",12,
2022-02-24,war,Замінований пляж,"Нацгвардійці замінували пляж ""Піщанка"", що межує з портом. Пізніше приїхали ""азовці"" з БТРом і протитанковими засобами. Разом організували спостережні пункти. 

З ""Донбасу"" зняли кулемети ДШК і встановили їх на позиціях. Передали боєкомплект з гармат катерів екіпажу БТР ""Азов"" (у бойових модулях БТР та катерів встановлено ту саму модель гармати).",,donbas23ZMO_port.jpg,,,,port_poly.geojson,,,,,
2022-02-24,war,Хто був у порту,"У Маріупольському загоні морської охорони з особового складу було 500 –550 осіб, з яких 200 – жінки. 
Зважаючи на те, що найпотужнішою зброєю плавзасобів 23 ЗМО були 30-мм гармати, керівництво загону вирішило відмовитися виходити в море, заповнене ворожими кораблями під прикриттям авіації.
 
З одного катера зняли радіолокаційну станцію (РЛС), яку перенесли до доку й підключили до акумулятора: щоб бачити переміщення ворога в акваторії Азовського моря, дані йшли до штабу оборони міста. 

У порту на 24 лютого перебували також два окремі взводи по семеро бійців (бердянський і маріупольський) протидиверсійного загону (801 ОЗБ ПДСЗ). Маріупольський взвод того дня залишив місто в повному складі, з бердянського залишились двоє осіб.
",,,Кораблі 23 ЗМО (Маріупольського загону морської оборони),"47.055475, 37.505733",Морський порт Маріуполя,port_poly.geojson,,port_points.geojson,"47.11, 37.57",12,
2022-02-25,civil,Порожні евакуаційні поїзди,"Маріуполь ще жив вірою в непереможність української армії. Вісім років містянам розповідали про три лінії оборони, посилений захист, бойові підрозділи з великим досвідом. Мер Маріуполя Вадим Бойченко теж закликав людей зберігати спокій і довіряти військовим. Люди і довіряли. Тому евакуаційні потяги на Західну Україну, які призначила Укрзалізниця, йшли з Маріуполя порожніми. Не користалась попитом і ініціатива «Все буде добре», яка пропонувала маріупольцям допомогу в евакуації.
Містяни воліли залишатись в місті попри вибухи і повітряні тривоги. Хтось вірив російській пропаганді, яка запевняла, ще все це – лише на три дні, а потім буде мир, весна, Росія. Хтось думав, що буде як в 2014 році – постріляють і на околицях міста зупиняться.",,,,,,,,,"47.11, 37.57",12,
2022-02-25,war,Шлях на Маріуполь із заходу відкритий для росіян ,"«На другий день, після захоплення Мелітополя, стала зрозуміла швидкість просування ворога, – каже Богдан Кротевич, майор, начальник штабу ОЗСП «АЗОВ». – Ми очікували висадки на ділянці узбережжя Азовського моря від Маріуполя до Юр’ївки, де ми несли чергування з протидесантної оборони, але її не сталося. 

",,,,,,,,,"47.11, 37.57",11,
2022-02-25,war,Підірвані мости,"Ми зрозуміли, що маємо ще трішки часу. Я зібрав командирів групи розвідки спецпризначення та командирів снайперської групи спецпризначення, щоб спланувати диверсію і зупинити колони, які рухалися у наш бік. Ми планували зустріти їх перед входом до Мангуша – висунулись туди, замінували мости, встановили протитанкові засоби. 

В нас снайперська група спецпризначення та група розвідки спеціального призначення – це два різні підрозділи, але вони вміють все. Це й протитанковий резерв, це й розвідники, це й диверсанти, це й снайпери. Я керував ними безпосередньо на місці, коли командир ОЗСП “АЗОВ” наказав повернутися до Маріуполя. 
Ми підірвали мости біля Мангуша і Старої Ялти та відійшли до міста».",,,,"47.082078, 37.181824

",Підірваний міст поблизу Мангуша,,,,,,
2022-02-25,civil,"Потреби зростають, ресурси тануть","Містяни ринулись в торгові центри і почали скуповувати їжу.
Дуже швидко на полицях не залишилось ніякої тушонки, а потім і все інше тривалого зберігання зникло. Вода, сірники, туалетний папір… Загалом стандартний набір, який люди купують в разі, якщо насувається будь-яка загроза.
Міська влада тим часом почала надолужувати втрачений час, роблячи те, що не зробила напередодні війни: екстрено закуповувала воду і їжу. Все це вигрібалось на складах оптових мегамаркетів і складалося на території КП «Комунальник» та Центрального ринку.

",,,shop_25.02.jpeg,,,,,,"47.101955482872434, 37.502292687150955",12,
